title,text,subject,date
Zlatan Ibrahimović: Ex-LA Galaxy star retires from professional soccer,Zlatan Ibrahimović an iconic and generational striker has retired from professional soccer.    The former LA Galaxy star age 41 announced his decision Sunday after AC Milan's final game of the 2022-23 Serie A season. The Swedish legend had explored the possibility of continuing playing but called it quits after injuries limited his role with I Rossoneri.   "The time has come to say goodbye to football not to you" Ibrahimović said at the San Siro.   Ibrahimović's professional career spanned from 1999-2023 playing for famed European clubs like Ajax Paris Saint-Germain Manchester United FC Barcelona AC Milan and more.,news,2023-06-04
Football: Zlatan Ibrahimovic says "goodbye to football" at 41,Highlights: Swedish striker Zlatan Ibrahimovic announced the end of his playing career at the age of 41. He told AC Milan fans on Sunday night that it was "the time to say goodbye to football" Due to repeated injuries the forty-year-old has hardly been able to play this season. The Swede started just one game this season in March in the 3-1 win at Udinese. He has also played for Ajax Amsterdam Juventus Inter Milan FC Barcelona Paris Saint-Germain and Manchester United.Swedish striker Zlatan Ibrahimovic announced the end of his playing career at the age of 41 telling AC Milan fans on Sunday night that it was "the time to say goodbye to football".,sport,2023-06-04
Tearful Zlatan Ibrahimovic 41 retires from football and teases next job as AC Milan legend says emotional goodbye,ZLATAN Ibrahimovic has retired from football with immediate effect.The Sweden legend 41 announced he was hanging up his boots following AC Milan's Serie A match against Verona.,news,2023-06-04
Zlatan Ibrahimovic: AC Milan striker to leave Serie A club after Verona game,Zlatan Ibrahimovic will leave AC Milan after their final match of the season against Hellas Verona on Sunday.,news,2023-06-03
Zlatan Ibrahimovic Set to Depart AC Milan After Final Match,(MENAFN) AC Milan announced on Saturday that Zlatan Ibrahimovic will be leaving the club following their last match of the season against Verona. In a statement the Serie A club confirmed that a ... ...... read full story,news,2023-06-04
Milan say Ibrahimovic will not extend contract,Soccer Football - Champions League - Quarter Finals - First Leg - AC Milan v Napoli - San Siro Milan Italy - April 12 2023 AC Milan's Zlatan Ibrahimovic is seen during the match REUTERS/Daniele MascoloJune 3 (Reuters) - Striker Zlatan Ibrahimovic will not extend his contract with AC Milan the Serie A club said on Saturday.The 41-year-old Swedish international's contract expires at the end of June and will not be renewed following a season plagued by injuries.Ibrahimovic has played only four matches in Serie A this season getting a total of 144 minutes on the field but became the oldest goalscorer in the league's history when he scored his only goal of the season by converting a penalty in a 3-1 loss at Udinese in March.,news,2023-06-03
Milan's Zlatan Ibrahimovic retires from football,Zlatan Ibrahimovic shows his love for AC Milan's fans after announcing his retirement from football. (AP PHOTO)Zlatan Ibrahimovic has announced his retirement from football at the age of 41.FacebookTwitterWhatsappEmailWe care about the protection of your data. Read our Privacy Policy.,news,2023-06-04
Zlatan Ibrahimovic to Depart AC Milan After Last Match of the Season: Club Announcement,Swedish striker Zlatan Ibrahimovic will leave AC Milan aged 41 after the last league match of the season against Hellas Verona on Sunday the Italian club announced on Saturday.« Tomorrow evening after the last match of the season… AC Milan will say goodbye to Zlatan Ibrahimovic after a brief ceremony ' writes the Milanese club in a press release. ' AC Milan would like to thank Zlatan for the wonderful times we spent together ' continues the club.Ibrahimovic 41 returned to Milan in 2019 and was crowned Italian champion last season.,news,2023-06-03
Zlatan Ibrahimovic breaks down in tears as he confirms retirement from football,Zlatan Ibrahimovic 41 has announced his decision to retire from football after spending the majority of the 22/23 season on the sidelines due to injury,news,2023-06-04
Tearful Ibrahimovic 41 retires from football as Milan legend says goodbye,end of an era Published: 22:38 4 Jun 2023Updated: 22:38 4 Jun 2023ZLATAN Ibrahimovic has retired from football with immediate effect.The Sweden legend 41 announced he was hanging up his boots following AC Milan's Serie A match against Verona.Zlatan Ibrahimovic has retired from football aged 41Credit: GettyIbrahimovic appears emotional as he watches on from the sidelinesCredit: Getty— Lega Serie A (@SerieA_EN) June 4 2023 **MORE TO FOLLOW**,news,2023-06-04
Zlatan Ibrahimovic's tears of joy while giving his retirement speech at AC Milan,It's over Zlatan Ibrahimovic. At the age of 41 the Swedish striker announced his retirement from soccer after AC Milan's match against Verona. After a season where he only played four games due to knee problems the 'Rossoneri' decided to put an end to his history in professional soccer with tears of joy.Zlatan Ibrahimovic's tears of joy while giving his retiring speech at AC MilanTwitterThe end of an era for Zlatan IbrahimovicAt the end of the match at San Siro Ibra said. "There are so many memories so many emotions.,sport,2023-06-04
'GODbye': AC Milan bid farewell to Zlatan Ibrahimovic,Published:  16:15 EDT 4 June 2023   |  Updated:  16:16 EDT 4 June 2023    AC Milan Fans  have bid farewell to Zlatan Ibrahmiovic with a huge sign reading 'Godbye' at their final game of the season against Verona.The 41-year-old is not playing in the game as he nurses an injury but will leave the club when his contract expires this summer.It will end a 17-year love affair with the San Siro where Zlatan has spent nine seasons of his career.  He has played for both Milan clubs racking up 159 goals and nine trophies in 229 games.,news,2023-06-04
Tearful Ibrahimovic 41 retires from football as Milan legend says goodbye,end of an era Published: 22:38 4 Jun 2023ZLATAN Ibrahimovic has retired from football with immediate effect.The Sweden legend 41 announced he was hanging up his boots following AC Milan's Serie A match against Verona.Zlatan Ibrahimovic has retired from football aged 41Credit: GettyIbrahimovic appears emotional as he watches on from the sidelinesCredit: Getty— Lega Serie A (@SerieA_EN) June 4 2023 **MORE TO FOLLOW**,news,2023-06-04
Zlatan Ibrahimovic bursts into tears at San Siro as AC Milan icon retires at 41,Zlatan Ibrahimovic: The iconic Swede has decided to retire. (Image: Twitter/Lega Serie A)Zlatan Ibrahimovic struggled to hold back his tears after announcing his decision to retire from football at the age of 41 following AC Milan's final game of the season on Sunday. The iconic Swede who played for two seasons in the Premier League with Manchester United is finally set to hang up his boots after a remarkable career that spanned across three decades and saw him collect domestic titles with five different clubs.,sport,2023-06-04
‘The time has come to say goodbye' – Zlatan Ibrahimovic retires aged 41,Zlatan Ibrahimovic has announced his retirement from football at the age of 41.The AC Milan striker made the announcement on the San Siro pitch following his club's final game of the Serie A season.'I have many memories and many emotions in here' the Sweden international said.You bow to no one King ??@Ibra_official #SempreMilan pic.twitter.com/R90EnbEoTp— AC Milan (@acmilan) June 4 2023 'The first time I arrived here you gave me happiness. The second time love. I will be a Milan fan for life.,news,2023-06-04
Clarification arrives regarding LED board message for Ibrahimovic,We have received clarification regarding the photo circulating on social media regarding a potential farewell for Zlatan Ibrahimovic.There has been speculation over the past couple of weeks that the game against Verona could be Ibrahimovic's last in a Milan shirt and he will not take part due to a calf injury.Twitter user Rácz Viktor did a stadium tour on Friday and got a glimpse of the LED boards which read ‘GodBye Zlatan'.However the photo circulating regarding the board message to Zlatan Ibrahimovic was just a test made days ago the club have told us.,news,2023-06-03
‘The time has come to say goodbye' – Zlatan Ibrahimovic retires aged 41,Zlatan Ibrahimovic has announced his retirement from football at the age of 41.The AC Milan striker made the announcement on the San Siro pitch following his club's final game of the Serie A season.'I have many memories and many emotions in here' the Sweden international said.'The first time I arrived here you gave me happiness. The second time love. I will be a Milan fan for life.'The time has come to say goodbye to football but not to you. See you around if you're lucky. Forza Milan and goodbye.,news,2023-06-04
Ibrahimovic to leave AC Milan with future unclear,Zlatan Ibrahimovic is to leave AC Milan after Sunday's final Serie A match. (EPA PHOTO)Zlatan Ibrahimovic 41 is leaving AC Milan and will bid goodbye in the Serie A season finale on Sunday.FacebookTwitterWhatsappEmailWe care about the protection of your data. Read our Privacy Policy.,news,2023-06-03
Zlatan Ibrahimovic retires: Football icon breaks down in tears as he makes announcement,Published: 22:38 4 Jun 2023Updated: 22:50 4 Jun 2023Zlatan Ibrahimovic has retired from football with immediate effect aged 41. The football icon cut a tearful figure as he made the announcement following AC Milan's final match of the 2022/23 Serie A season. Ibrahmimovic was in tears as the announcement was madeHe told the San Siro crowd: "The time has come to say goodbye."For the latest on this and other breaking news stories listen to talkSPORT,news,2023-06-04
Zlatan Ibrahimovic announces retirement from football after AC Milan exit,Zlatan Ibrahimovic has announced his immediate retirement from football.Manchester United news exclusives and analysis Privacy PolicyIn his speech at San Siro on Sunday evening Ibrahimovic said: ‘So many memories and emotions inside this stadium.‘The first time I arrived you gave me happiness the second time you gave me love. I want to thank my family and those close to me for their patience. I want to thank my second family. The players the coach and his staff for the responsibility they gave me.,news,2023-06-04
AC Milan Makes Huge Decision On Zlatan Ibrahimovic's Future,Zlatan Ibrahimovic is one of the most legendary strikers in soccer history and he is still going strong at age 41 in the Serie A for AC Milan. Despite that it looks like Ibrahimovic's future with Milan will be coming to an end soon as it's been reported that his contract will not be renewed after the season meaning Ibra will have to find a new club if he intends to continue playing soccer.Ibrahimovic's second stint with Milan hasn't been nearly as fruitful as his first but he was still a productive player for them up until this season.,sport,2023-06-03
Milan say Ibrahimovic will not extend contract,Striker Zlatan Ibrahimovic will not extend his contract with AC Milan the Serie A club said on Saturday.The 41-year-old Swedish international's contract expires at the end of June and will not be renewed following a season plagued by injuries.Ibrahimovic has played only four matches in Serie A this season getting a total of 144 minutes on the field but became the oldest goalscorer in the league's history when he scored his only goal of the season by converting a penalty in a 3-1 loss at Udinese in March.,news,2023-06-03
Zlatan Ibrahimovic retires from football and breaks down in tears on the pitch,Zlatan Ibrahimovic has retired from professional football at the age of 41 and he broke down in tears after receiving a spine-tingling reception from his AC Milan teammates.The striker announced he would be calling time on his legendary 24-year career following Milan's final Serie A game of the season against Hellas Verona.Ibrahimovic said per Goal: "The first time we arrived in Milan you gave me happiness the second time you gave me love. From my heart I want to thank you fans."You welcomed me with open arms you made me feel at home.,news,2023-06-04
‘The time has come to say goodbye' – Zlatan Ibrahimovic retires aged 41,Zlatan Ibrahimovic has announced his retirement from football at the age of 41.The AC Milan striker made the announcement on the San Siro pitch following his club's final game of the Serie A season.'I have many memories and many emotions in here' the Sweden international said.You bow to no one King 👑🥹@Ibra_official #SempreMilan pic.twitter.com/R90EnbEoTp— AC Milan (@acmilan) June 4 2023'The first time I arrived here you gave me happiness. The second time love. I will be a Milan fan for life.,news,2023-06-04
Ibrahimovic to leave Milan at season's end: club,Zlatan Ibrahimovic will leave AC Milan after their final match of the season against Verona the Serie A club said on Saturday."Tomorrow (Sunday) evening after the final game of the season... AC Milan will say goodbye to Zlatan Ibrahimovic with a brief ceremony" Milan said in a statement."AC Milan would like to thank Zlatan for the magnificent time that we have spent together."Ibrahimovic was a key figure in Milan's resurgence to the top of Italian football after his return to the club as a free agent in late 2019 helping to bring them back from the doldrums and eventually win Serie A last season.,news,2023-06-03
‘The time has come to say goodbye' – Zlatan Ibrahimovic retires aged 41,Zlatan Ibrahimovic has announced his retirement from football at the age of 41.The AC Milan striker made the announcement on the San Siro pitch following his club's final game of the Serie A season.'I have many memories and many emotions in here' the Sweden international said.You bow to no one King 👑🥹@Ibra_official #SempreMilan pic.twitter.com/R90EnbEoTp— AC Milan (@acmilan) June 4 2023'The first time I arrived here you gave me happiness. The second time love. I will be a Milan fan for life.,world,2023-06-04
Soccer-Milan say Ibrahimovic will not extend contract,(Reuters) – Striker Zlatan Ibrahimovic will not extend his contract with AC Milan the Serie A club said on Saturday.The 41-year-old Swedish international's contract expires at the end of June and will not be renewed following a season plagued by injuries.Ibrahimovic has played only four matches in Serie A this season getting a total of 144 minutes on the field but became the oldest goalscorer in the league's history when he scored his only goal of the season by converting a penalty in a 3-1 loss at Udinese in March.,news,2023-06-03
Soccer-Milan say Ibrahimovic will not extend contract,Striker Zlatan Ibrahimovic will not extend his contract with AC Milan the Serie A club said on Saturday. The 41-year-old Swedish international's contract expires at the end of June and will not be renewed following a season plagued by injuries.Ibrahimovic has played only four matches in Serie A this season getting a total of 144 minutes on the field but became the oldest goalscorer in the league's history when he scored his only goal of the season by converting a penalty in a 3-1 loss at Udinese in March.,news,2023-06-03
Ibrahimovic to leave Milan at season's end: club,Milan (AFP) – Zlatan Ibrahimovic will leave AC Milan after their final match of the season against Verona the Serie A club said on Saturday.Advertising Read more"Tomorrow (Sunday) evening after the final game of the season... AC Milan will say goodbye to Zlatan Ibrahimovic with a brief ceremony" Milan said in a statement."AC Milan would like to thank Zlatan for the magnificent time that we have spent together."Ibrahimovic was a key figure in Milan's resurgence to the top of Italian football after his return to the club as a free agent in late 2019 helping to bring them back from the doldrums and eventually win Serie A last season.,business,2023-06-03
Ibrahimovic To Leave Milan At Season's End: Club,By AFP - Agence France Presse   June 3 2023    Order Reprints   Print Article      Zlatan Ibrahimovic will leave AC Milan after their final match of the season against Verona the Serie A club said on Saturday. "Tomorrow (Sunday) evening after the final game of the season... AC Milan will say goodbye to Zlatan Ibrahimovic with a brief ceremony" Milan said in a statement. "AC Milan would like to thank Zlatan for the magnificent time that we have spent together." Ibrahimovic was a key figure in Milan's resurgence to the top of Italian football after his return to the club as a free agent in late 2019 helping to bring them back from the doldrums and eventually win Serie A last season.,news,2023-06-03
Ibrahimovic to leave Milan at season's end: club,Zlatan Ibrahimovic will leave AC Milan after their final match of the season against Verona the Serie A club said on Saturday.'Tomorrow (Sunday) evening after the final game of the season… AC Milan will say goodbye to Zlatan Ibrahimovic with a brief ceremony' Milan said in a statement.'AC Milan would like to thank Zlatan for the magnificent time that we have spent together.'Ibrahimovic was a key figure in Milan's resurgence to the top of Italian football after his return to the club as a free agent in late 2019 helping to bring them back from the doldrums and eventually win Serie A last season.,news,2023-06-03
Serie A: Ibrahimovic will not extend his contract with Milan after the season,Published : Jun 03 2023 22:27 IST   CHENNAI - 1 MIN READ After winning the Scudetto in 2011 with Milan Ibrahimovic arrived at the club for his second spell in 2020 and helped the club win the title last season. | Photo Credit: REUTERSAfter winning the Scudetto in 2011 with Milan Ibrahimovic arrived at the club for his second spell in 2020 and helped the club win the title last season. | Photo Credit: REUTERSAC Milan confirmed on Saturday that Sweden forward Zlatan Ibrahimovic will not extend his contract after the season.,sport,2023-06-03
Ibrahimovic retires from football,football04 June 2023 21:49| © ReutersZlatan Ibrahimovic © Gallo Images AC Milan's Sweden striker Zlatan Ibrahimovic said on Sunday he had decided to end his football career.  The 41-year-old's Milan contract expires at the end of June and will not be renewed following a season plagued by injuries prompting him to end a remarkable and successful career.  Ibrahimovic arrived in Milan for his second spell with the club in early 2020 having won the Scudetto with them in 2011 and helped them win the title again last season.,news,2023-06-04
Zlatan Ibrahimović retires at 41 after 22 seasons,Zlatan Ibrahimović the 41-year-old striker whose legendary career in first-tier European and American soccer spans over two decades has announced his retirement.The news comes one day after Ibrahimović announced the end of his second stint with AC Milan after Sunday's Serie A season finale against Hellas Verona followed by statements that he didn't want to call it a career just yet. "The first time we arrived at Milan you gave me happiness the second time you gave me love" Ibrahimović said.,news,2023-06-03
Turkey's First Gastronomy Street in Afyon,Work continues on the Gastronomy Street project which is one of the investments made in the field of gastronomy in the UNESCO-registered Gastronomy city of Afyonkarahisar. The construction level in Gastronomy Street the product of our Mayor Mehmet Zeybek's work has reached 50%.In Gastronomy Street one of the vision projects that will befit the Gastronomy City Afyonkarahisar our local delicacies will be offered to local and foreign visitors for sale and appreciation. Work on the project which will support and shape both commercial and social life in Afyonkarahisar has been halved.,news,2023-05-30
New COD Gastronomy and Marketing in Hospitality certificate helps businesses startups gain industry foothold,College of DuPage's Culinary and Hospitality program is helping existing and new businesses expand their industry reach thanks to a new 9-credit-hour certificate program launching this fall. COD's Gastronomy and Marketing in Hospitality certificate is offered as a single course allowing students to earn their credential in just one semester. Hospitality and Tourism Professor Mary Beth Leone began conceptualizing the certificate's curriculum when students told her they wanted to learn more about the marketing side of the industry.,news,2023-05-31
Gastronomy Festival: Spanish Embassy to hold masterclass on culinary arts,Top Diplomats of the Spanish Embassy in Abuja have confirmed their participation in this year's NIHOTOUR Gastronomy Festival.This will be the embassy's consecutive appearance at the crowd-pulling food festival which is emerging as one of the fastest growing in Africa.Some months back NIHOTOUR announced 17th June 2023 as the date of the Gastronomy Festival and Abuja International Conference Centre as the venue of the food and culture jamboree.Interestingly observers of developments in Nigeria's hospitality and tourism sector may recall that the Spanish Embassy's cuisines exhibition stand during the 2022 NIHOTOUR Gastronomy Festival was one of the most visited by food sampling participants at the festival in Abuja.,news,2023-06-03
Clube Militar to kick off gastronomy festival Jun. 18,Clube Militar de Macau will carry out another Portuguese Gastronomy and Wine Festival headed by Chef António Loureiro from June 18 to October 27. This is the 24th Portuguese Gastronomy Festival held by the Macao Military Club since 2000 and within its scope is the Clube Militar that has brought 14 of Portugal's renowned chefs to Macau. 'With these festivals the Clube Militar aimed and has achieved to great success the promotion of Portuguese gastronomy in Macau and the promotion of Macau for the quality and diversity of its gastronomic offering and the training and improvement of its professionals' organizers said in a statement.,news,2023-06-02
Algarve to host first Portuguese-only Michelin gala,Portugal is finally getting its own Michelin Guide!The Algarve has been chosen to host the first exclusively Portuguese Michelin gala.The event will take place at NAU Salgados Palace & Congress Centre in Guia Albufeira on February 27 2024 and will mark the launch of the first Michelin Guide dedicated solely to Portuguese restaurants.Around 500 guests are expected for the gala event said Portugal's Michelin Guide representative Nuno Ferreira at a press conference held at the Algarve Hotel and Tourism School in Faro this Friday (June 2).,news,2023-06-02
Honouring Portuguese cuisine – Portugal to receive its own Michelin Guide,Explore The Portugal News on your mobile app. Download Now!             Click here to close           For the first time ever there will be a Michelin Guide solely for Portugal with the Algarve being chosen to host the first Gala in celebration.  By Paula Martins in News Portugal Tourism Algarve · 02 Jun 2023 15:02 · 0 Comments         Author: Paula Martins;     On 27 February 2024 the first Michelin Guideline Gala in Portugal will take place in Albufeira celebrating the best of Portuguese gastronomy.,news,2023-06-02
5 Thai cities recognized by UNESCO as Creative Cities in various categories,Thailand has garnered international recognition as UNESCO has designated five cities in the country as Creative Cities in various categories including gastronomy crafts folk arts and design.Thailand has garnered international recognition as UNESCO has designated five cities in the country as Creative Cities in various categories including gastronomy crafts folk arts and design.The announcement was made by Government Spokesperson Anucha Burapachaisri who emphasized the presence of diverse creative talents and cultural heritage in these cities.,news,2023-06-05
UNESCO recognises five creative cities in Thailand,UNESCO has recognised five creative cities in Thailand for gastronomy crafts folk arts and design according to Anucha Burapachaisri spokesman for the government.Phuket was first granted the UNESCO creative city of gastronomy status in 2015 for its traditional food varietieswhich have been passed down from one generation to another. The local food industry earns the island province an estimated US$3.6 billion in revenue each year said Anucha.Chiang Mai was recognised by UNESCO for its crafts and folk arts in 2017.,news,2023-06-04
A Foodie Frenzy in France,Both northern and eastern France are ideal destinations to formulate tasty trails this year with Hauts-de-France's European Region of Gastronomy award and the return of the Vallée de la Gastronomie from Dijon to Marseille (contact us for press trip inspiration). And to wash it all down this weekend sees National Cognac Day open a fine season ahead in the vineyards of Charentes.Arras to host first ever French Fries World ChampionshipsDid you know there are some 1400 French fry stalls throughout France – 55% of which can be found in Hauts-de-France alone? On 7 October this year the ‘Championnat du Monde de la Frite' will be held for the first time in Arras at the heart of the region.,news,2023-05-31
New Hire: Five Minutes With Jorge Alcala Executive Chef at Recently Reopened Taqiza,It's been six years since taqueria Taqiza opened bringing breezy Mexican-inspired dining and drinking to the heart of Bondi. To mark its anniversary it's moved down the road to the former La Palma space and has refocused on highlighting premium and rare mezcal and tequila. Like at operator Milpa Collective's other venues (including  Londres 126 and Carbon) those agave spirits are served neat or in an array of cocktails that go beyond Margaritas.  Jorge Alcala has been Milpa Collective's executive chef for the past year.,news,2023-05-30
